{
  "causal_links": [
    {
      "actor": "user",
      "cause": "edit_document:0",
      "event_id": "0809afd8-8ca4-52b1-be18-02d94323c06e"
    },
    {
      "actor": "none",
      "cause": "edit_document:1",
      "event_id": "9c1a8b90-5519-5876-b2b9-4dd8d26eb1e3"
    },
    {
      "actor": "agent",
      "cause": "edit_document:2",
      "event_id": "aaf65f50-a4ab-5f3b-9d96-64bd1aa5e1ab"
    },
    {
      "actor": "user",
      "cause": "switch_window:0",
      "event_id": "1ce35e44-bd6d-5f7c-b01f-972d85e0b9a0"
    },
    {
      "actor": "user",
      "cause": "switch_window:1",
      "event_id": "d45296b5-986f-5d31-8dbd-c67c383d1c18"
    },
    {
      "actor": "agent",
      "cause": "switch_window:2",
      "event_id": "12d73a63-3336-5077-9641-486fc943071e"
    },
    {
      "actor": "user",
      "cause": "edit_document:0",
      "event_id": "7a89c7b3-f677-5276-9f6d-1cb600c0e259"
    },
    {
      "actor": "none",
      "cause": "edit_document:1",
      "event_id": "00cebe09-7ac2-533d-85c3-f363bea674eb"
    },
    {
      "actor": "agent",
      "cause": "edit_document:2",
      "event_id": "0baa3bf7-e000-5c7a-b6ee-8906ab50ef7b"
    },
    {
      "actor": "none",
      "cause": "open_editor:0",
      "event_id": "eefc4441-54d8-521b-985e-f9c3519b9da2"
    },
    {
      "actor": "user",
      "cause": "open_editor:1",
      "event_id": "e8f419bd-0366-5227-9529-092e6911c752"
    },
    {
      "actor": "agent",
      "cause": "open_editor:2",
      "event_id": "fcb77866-d10d-5917-9867-4d91fc61456e"
    }
  ],
  "episode_ids": [
    "cc7a3314-d418-59b9-b5bb-3a8294eac853",
    "f00c8f0f-9e7d-52c0-8a52-4c0bdb5708e2",
    "b8ac06b5-f7ae-5923-a6cf-7ebe830e5c9d",
    "58e707fd-1249-5a12-b24f-d639fb215f6a"
  ],
  "episodes": [
    {
      "boundary_reason": "routine_transition",
      "episode_id": "cc7a3314-d418-59b9-b5bb-3a8294eac853",
      "event_ids": [
        "0809afd8-8ca4-52b1-be18-02d94323c06e",
        "9c1a8b90-5519-5876-b2b9-4dd8d26eb1e3",
        "aaf65f50-a4ab-5f3b-9d96-64bd1aa5e1ab"
      ],
      "routine": "edit_document",
      "session_id": "43485513-84f8-5e06-a875-bead6a461e9c"
    },
    {
      "boundary_reason": "routine_transition",
      "episode_id": "f00c8f0f-9e7d-52c0-8a52-4c0bdb5708e2",
      "event_ids": [
        "1ce35e44-bd6d-5f7c-b01f-972d85e0b9a0",
        "d45296b5-986f-5d31-8dbd-c67c383d1c18",
        "12d73a63-3336-5077-9641-486fc943071e"
      ],
      "routine": "switch_window",
      "session_id": "43485513-84f8-5e06-a875-bead6a461e9c"
    },
    {
      "boundary_reason": "routine_transition",
      "episode_id": "b8ac06b5-f7ae-5923-a6cf-7ebe830e5c9d",
      "event_ids": [
        "7a89c7b3-f677-5276-9f6d-1cb600c0e259",
        "00cebe09-7ac2-533d-85c3-f363bea674eb",
        "0baa3bf7-e000-5c7a-b6ee-8906ab50ef7b"
      ],
      "routine": "edit_document",
      "session_id": "43485513-84f8-5e06-a875-bead6a461e9c"
    },
    {
      "boundary_reason": "routine_transition",
      "episode_id": "58e707fd-1249-5a12-b24f-d639fb215f6a",
      "event_ids": [
        "eefc4441-54d8-521b-985e-f9c3519b9da2",
        "e8f419bd-0366-5227-9529-092e6911c752",
        "fcb77866-d10d-5917-9867-4d91fc61456e"
      ],
      "routine": "open_editor",
      "session_id": "43485513-84f8-5e06-a875-bead6a461e9c"
    }
  ],
  "events": [
    {
      "event_id": "0809afd8-8ca4-52b1-be18-02d94323c06e",
      "event_type": "text_inserted",
      "occurred_at": "2026-01-01T00:00:00Z",
      "payload": {
        "local_index": 0,
        "routine": "edit_document",
        "subject": "document"
      },
      "sequence": 0,
      "session_id": "43485513-84f8-5e06-a875-bead6a461e9c",
      "source": "user"
    },
    {
      "event_id": "9c1a8b90-5519-5876-b2b9-4dd8d26eb1e3",
      "event_type": "file_changed",
      "occurred_at": "2026-01-01T00:00:01Z",
      "payload": {
        "local_index": 1,
        "routine": "edit_document",
        "subject": "document"
      },
      "sequence": 1,
      "session_id": "43485513-84f8-5e06-a875-bead6a461e9c",
      "source": "system"
    },
    {
      "event_id": "aaf65f50-a4ab-5f3b-9d96-64bd1aa5e1ab",
      "event_type": "save_suggested",
      "occurred_at": "2026-01-01T00:00:02Z",
      "payload": {
        "local_index": 2,
        "routine": "edit_document",
        "subject": "document"
      },
      "sequence": 2,
      "session_id": "43485513-84f8-5e06-a875-bead6a461e9c",
      "source": "agent"
    },
    {
      "event_id": "1ce35e44-bd6d-5f7c-b01f-972d85e0b9a0",
      "event_type": "window_blurred",
      "occurred_at": "2026-01-01T00:00:03Z",
      "payload": {
        "local_index": 0,
        "routine": "switch_window",
        "subject": "editor"
      },
      "sequence": 3,
      "session_id": "43485513-84f8-5e06-a875-bead6a461e9c",
      "source": "user"
    },
    {
      "event_id": "d45296b5-986f-5d31-8dbd-c67c383d1c18",
      "event_type": "window_focused",
      "occurred_at": "2026-01-01T00:00:04Z",
      "payload": {
        "local_index": 1,
        "routine": "switch_window",
        "subject": "browser"
      },
      "sequence": 4,
      "session_id": "43485513-84f8-5e06-a875-bead6a461e9c",
      "source": "user"
    },
    {
      "event_id": "12d73a63-3336-5077-9641-486fc943071e",
      "event_type": "context_recovered",
      "occurred_at": "2026-01-01T00:00:05Z",
      "payload": {
        "local_index": 2,
        "routine": "switch_window",
        "subject": "browser"
      },
      "sequence": 5,
      "session_id": "43485513-84f8-5e06-a875-bead6a461e9c",
      "source": "agent"
    },
    {
      "event_id": "7a89c7b3-f677-5276-9f6d-1cb600c0e259",
      "event_type": "text_inserted",
      "occurred_at": "2026-01-01T00:00:06Z",
      "payload": {
        "local_index": 0,
        "routine": "edit_document",
        "subject": "document"
      },
      "sequence": 6,
      "session_id": "43485513-84f8-5e06-a875-bead6a461e9c",
      "source": "user"
    },
    {
      "event_id": "00cebe09-7ac2-533d-85c3-f363bea674eb",
      "event_type": "file_changed",
      "occurred_at": "2026-01-01T00:00:07Z",
      "payload": {
        "local_index": 1,
        "routine": "edit_document",
        "subject": "document"
      },
      "sequence": 7,
      "session_id": "43485513-84f8-5e06-a875-bead6a461e9c",
      "source": "system"
    },
    {
      "event_id": "0baa3bf7-e000-5c7a-b6ee-8906ab50ef7b",
      "event_type": "save_suggested",
      "occurred_at": "2026-01-01T00:00:08Z",
      "payload": {
        "local_index": 2,
        "routine": "edit_document",
        "subject": "document"
      },
      "sequence": 8,
      "session_id": "43485513-84f8-5e06-a875-bead6a461e9c",
      "source": "agent"
    },
    {
      "event_id": "eefc4441-54d8-521b-985e-f9c3519b9da2",
      "event_type": "process_started",
      "occurred_at": "2026-01-01T00:00:09Z",
      "payload": {
        "local_index": 0,
        "routine": "open_editor",
        "subject": "editor"
      },
      "sequence": 9,
      "session_id": "43485513-84f8-5e06-a875-bead6a461e9c",
      "source": "system"
    },
    {
      "event_id": "e8f419bd-0366-5227-9529-092e6911c752",
      "event_type": "window_focused",
      "occurred_at": "2026-01-01T00:00:10Z",
      "payload": {
        "local_index": 1,
        "routine": "open_editor",
        "subject": "editor"
      },
      "sequence": 10,
      "session_id": "43485513-84f8-5e06-a875-bead6a461e9c",
      "source": "user"
    },
    {
      "event_id": "fcb77866-d10d-5917-9867-4d91fc61456e",
      "event_type": "attention_selected",
      "occurred_at": "2026-01-01T00:00:11Z",
      "payload": {
        "local_index": 2,
        "routine": "open_editor",
        "subject": "editor"
      },
      "sequence": 11,
      "session_id": "43485513-84f8-5e06-a875-bead6a461e9c",
      "source": "agent"
    }
  ],
  "generator_version": "1.0.0",
  "schema_version": "1.0",
  "seed": 20260730,
  "session_id": "43485513-84f8-5e06-a875-bead6a461e9c"
}
