{
  "causal_links": [
    {
      "actor": "external",
      "cause": "external_interrupt:0",
      "event_id": "2263dab0-4754-50f0-94f2-69d941104bbd"
    },
    {
      "actor": "user",
      "cause": "external_interrupt:1",
      "event_id": "17808ac9-9aa4-5e71-a468-7746ca36aa0b"
    },
    {
      "actor": "agent",
      "cause": "external_interrupt:2",
      "event_id": "c74c1c68-def2-5bf8-aa36-7122867bed75"
    },
    {
      "actor": "external",
      "cause": "external_interrupt:0",
      "event_id": "d6c0824d-7361-50f6-937f-e91296e070a2"
    },
    {
      "actor": "user",
      "cause": "external_interrupt:1",
      "event_id": "01456c7b-68bf-5be4-8870-de6a97ae0cef"
    },
    {
      "actor": "agent",
      "cause": "external_interrupt:2",
      "event_id": "7495e31b-10fb-566c-b4ee-8029d35123a7"
    },
    {
      "actor": "external",
      "cause": "external_interrupt:0",
      "event_id": "0ce46341-0cf1-593c-9564-7b036f671b71"
    },
    {
      "actor": "user",
      "cause": "external_interrupt:1",
      "event_id": "02ca44bf-0518-534e-a2e2-e899051c2597"
    },
    {
      "actor": "agent",
      "cause": "external_interrupt:2",
      "event_id": "48f494cd-72cf-5fbe-bde0-a87bdec18715"
    },
    {
      "actor": "user",
      "cause": "edit_document:0",
      "event_id": "5ac1d8b5-4377-5bf3-87e6-ca43774d5127"
    },
    {
      "actor": "none",
      "cause": "edit_document:1",
      "event_id": "9e55a2a3-4c8b-528d-b521-081ecf55855d"
    },
    {
      "actor": "agent",
      "cause": "edit_document:2",
      "event_id": "f5d874ec-e143-58c5-9696-8fa747149edf"
    }
  ],
  "episode_ids": [
    "959540bd-7cce-59c0-942c-97297f23e48f",
    "cf84c6d1-69aa-57a7-a1ee-c160cd31f6da",
    "5e4380bb-5d8f-5408-b355-26734506ce27",
    "a3a21b27-efc6-575a-af55-cd523cd643a0"
  ],
  "episodes": [
    {
      "boundary_reason": "routine_transition",
      "episode_id": "959540bd-7cce-59c0-942c-97297f23e48f",
      "event_ids": [
        "2263dab0-4754-50f0-94f2-69d941104bbd",
        "17808ac9-9aa4-5e71-a468-7746ca36aa0b",
        "c74c1c68-def2-5bf8-aa36-7122867bed75"
      ],
      "routine": "external_interrupt",
      "session_id": "a02978fe-cb63-5720-a5e8-b3c07606d205"
    },
    {
      "boundary_reason": "routine_transition",
      "episode_id": "cf84c6d1-69aa-57a7-a1ee-c160cd31f6da",
      "event_ids": [
        "d6c0824d-7361-50f6-937f-e91296e070a2",
        "01456c7b-68bf-5be4-8870-de6a97ae0cef",
        "7495e31b-10fb-566c-b4ee-8029d35123a7"
      ],
      "routine": "external_interrupt",
      "session_id": "a02978fe-cb63-5720-a5e8-b3c07606d205"
    },
    {
      "boundary_reason": "routine_transition",
      "episode_id": "5e4380bb-5d8f-5408-b355-26734506ce27",
      "event_ids": [
        "0ce46341-0cf1-593c-9564-7b036f671b71",
        "02ca44bf-0518-534e-a2e2-e899051c2597",
        "48f494cd-72cf-5fbe-bde0-a87bdec18715"
      ],
      "routine": "external_interrupt",
      "session_id": "a02978fe-cb63-5720-a5e8-b3c07606d205"
    },
    {
      "boundary_reason": "routine_transition",
      "episode_id": "a3a21b27-efc6-575a-af55-cd523cd643a0",
      "event_ids": [
        "5ac1d8b5-4377-5bf3-87e6-ca43774d5127",
        "9e55a2a3-4c8b-528d-b521-081ecf55855d",
        "f5d874ec-e143-58c5-9696-8fa747149edf"
      ],
      "routine": "edit_document",
      "session_id": "a02978fe-cb63-5720-a5e8-b3c07606d205"
    }
  ],
  "events": [
    {
      "event_id": "2263dab0-4754-50f0-94f2-69d941104bbd",
      "event_type": "notification_received",
      "occurred_at": "2026-01-01T00:00:00Z",
      "payload": {
        "local_index": 0,
        "routine": "external_interrupt",
        "subject": "calendar"
      },
      "sequence": 0,
      "session_id": "a02978fe-cb63-5720-a5e8-b3c07606d205",
      "source": "external"
    },
    {
      "event_id": "17808ac9-9aa4-5e71-a468-7746ca36aa0b",
      "event_type": "notification_opened",
      "occurred_at": "2026-01-01T00:00:01Z",
      "payload": {
        "local_index": 1,
        "routine": "external_interrupt",
        "subject": "calendar"
      },
      "sequence": 1,
      "session_id": "a02978fe-cb63-5720-a5e8-b3c07606d205",
      "source": "user"
    },
    {
      "event_id": "c74c1c68-def2-5bf8-aa36-7122867bed75",
      "event_type": "question_prepared",
      "occurred_at": "2026-01-01T00:00:02Z",
      "payload": {
        "local_index": 2,
        "routine": "external_interrupt",
        "subject": "calendar"
      },
      "sequence": 2,
      "session_id": "a02978fe-cb63-5720-a5e8-b3c07606d205",
      "source": "agent"
    },
    {
      "event_id": "d6c0824d-7361-50f6-937f-e91296e070a2",
      "event_type": "notification_received",
      "occurred_at": "2026-01-01T00:00:03Z",
      "payload": {
        "local_index": 0,
        "routine": "external_interrupt",
        "subject": "calendar"
      },
      "sequence": 3,
      "session_id": "a02978fe-cb63-5720-a5e8-b3c07606d205",
      "source": "external"
    },
    {
      "event_id": "01456c7b-68bf-5be4-8870-de6a97ae0cef",
      "event_type": "notification_opened",
      "occurred_at": "2026-01-01T00:00:04Z",
      "payload": {
        "local_index": 1,
        "routine": "external_interrupt",
        "subject": "calendar"
      },
      "sequence": 4,
      "session_id": "a02978fe-cb63-5720-a5e8-b3c07606d205",
      "source": "user"
    },
    {
      "event_id": "7495e31b-10fb-566c-b4ee-8029d35123a7",
      "event_type": "question_prepared",
      "occurred_at": "2026-01-01T00:00:05Z",
      "payload": {
        "local_index": 2,
        "routine": "external_interrupt",
        "subject": "calendar"
      },
      "sequence": 5,
      "session_id": "a02978fe-cb63-5720-a5e8-b3c07606d205",
      "source": "agent"
    },
    {
      "event_id": "0ce46341-0cf1-593c-9564-7b036f671b71",
      "event_type": "notification_received",
      "occurred_at": "2026-01-01T00:00:06Z",
      "payload": {
        "local_index": 0,
        "routine": "external_interrupt",
        "subject": "calendar"
      },
      "sequence": 6,
      "session_id": "a02978fe-cb63-5720-a5e8-b3c07606d205",
      "source": "external"
    },
    {
      "event_id": "02ca44bf-0518-534e-a2e2-e899051c2597",
      "event_type": "notification_opened",
      "occurred_at": "2026-01-01T00:00:07Z",
      "payload": {
        "local_index": 1,
        "routine": "external_interrupt",
        "subject": "calendar"
      },
      "sequence": 7,
      "session_id": "a02978fe-cb63-5720-a5e8-b3c07606d205",
      "source": "user"
    },
    {
      "event_id": "48f494cd-72cf-5fbe-bde0-a87bdec18715",
      "event_type": "question_prepared",
      "occurred_at": "2026-01-01T00:00:08Z",
      "payload": {
        "local_index": 2,
        "routine": "external_interrupt",
        "subject": "calendar"
      },
      "sequence": 8,
      "session_id": "a02978fe-cb63-5720-a5e8-b3c07606d205",
      "source": "agent"
    },
    {
      "event_id": "5ac1d8b5-4377-5bf3-87e6-ca43774d5127",
      "event_type": "text_inserted",
      "occurred_at": "2026-01-01T00:00:09Z",
      "payload": {
        "local_index": 0,
        "routine": "edit_document",
        "subject": "document"
      },
      "sequence": 9,
      "session_id": "a02978fe-cb63-5720-a5e8-b3c07606d205",
      "source": "user"
    },
    {
      "event_id": "9e55a2a3-4c8b-528d-b521-081ecf55855d",
      "event_type": "file_changed",
      "occurred_at": "2026-01-01T00:00:10Z",
      "payload": {
        "local_index": 1,
        "routine": "edit_document",
        "subject": "document"
      },
      "sequence": 10,
      "session_id": "a02978fe-cb63-5720-a5e8-b3c07606d205",
      "source": "system"
    },
    {
      "event_id": "f5d874ec-e143-58c5-9696-8fa747149edf",
      "event_type": "save_suggested",
      "occurred_at": "2026-01-01T00:00:11Z",
      "payload": {
        "local_index": 2,
        "routine": "edit_document",
        "subject": "document"
      },
      "sequence": 11,
      "session_id": "a02978fe-cb63-5720-a5e8-b3c07606d205",
      "source": "agent"
    }
  ],
  "generator_version": "1.0.0",
  "schema_version": "1.0",
  "seed": 20260729,
  "session_id": "a02978fe-cb63-5720-a5e8-b3c07606d205"
}
